{
  "schema_version": "1.0.0",
  "job_id": "job-<stable-approved-identifier>",
  "status": "APPROVED",
  "current_wave_id": null,
  "approved_scope": {
    "authority_reference": "<human-CS2-approved-job-and-wave-plan>",
    "acceptance_obligations": ["<integrated-functional-delivery>", "<integrated-regression-evidence>", "<whole-job-acceptance>"]
  },
  "envelope": {
    "max_active_jobs": 1,
    "max_active_waves": 1,
    "max_material_corrections": 1,
    "max_dispatch_runtime_minutes": 30,
    "max_total_runtime_minutes": 120,
    "spend_telemetry_mode": "RUNTIME_ONLY",
    "human_reset_required": true
  },
  "waves": [
    {
      "wave_id": "wave-<stable-identifier>",
      "ordinal": 1,
      "status": "PLANNED",
      "depends_on": [],
      "scope": ["<explicitly-approved-scope>"],
      "acceptance_obligations": ["<wave-obligation>"],
      "merge_evidence": null
    }
  ],
  "events": [],
  "final_acceptance": null
}
